<?xml version="1.0" encoding="utf-8"?>
<Config xmlns:xsi="http://www.w3.org/2001/XMLSchema-instance"
  xsi:noNamespaceSchemaLocation="ConfigSchema.xsd">
  <objList>
    <obj>
      <point x="210" y="70"/>
      <point x="410" y="70"/>
      <point x="410" y="110"/>
      <point x="210" y="110"/>
    </obj>
  </objList>
  <walkerList>
    
  </walkerList>
</Config>