<?xml version="1.0" encoding="utf-8"?>
<objList xmlns:xsi="http://www.w3.org/2001/XMLSchema-instance"
  xsi:noNamespaceSchemaLocation="configSchema.xsd">
  <obj>
    <point x="110" y="50"/>
    <point x="410" y="50"/>
    <point x="410" y="100"/>
    <point x="120" y="100"/>
  </obj>
    <obj>
        <point x="110" y="250"/>
        <point x="210" y="200"/>
        <point x="160" y="300"/>
    </obj>
    <!-- <obj>
        <point x="310" y="100"/>
        <point x="360" y="20"/>
        <point x="450" y="150"/>
        <point x="380" y="300"/>
        <point x="330" y="280"/>
    </obj> -->
</objList>