<?xml version="1.0" encoding="utf-8"?>
<Config xmlns:xsi="http://www.w3.org/2001/XMLSchema-instance"
        xsi:noNamespaceSchemaLocation="ConfigSchema.xsd">
    <objList>
        <obj>
            <point x="220" y="0"/>
            <point x="310" y="0"/>
            <point x="310" y="100"/>
            <point x="220" y="100"/>
        </obj>
        <obj>
            <point x="250" y="120"/>
            <point x="220" y="500"/>
            <point x="310" y="500"/>
        </obj>
    </objList>
    <walkerList>
        <walker>
            <source x="20" y="20"/>
            <target x="520" y="300"/>
        </walker>
        <walker>
            <source x="20" y="300"/>
            <target x="520" y="20"/>
        </walker>
        <walker>
            <source x="20" y="100"/>
            <target x="520" y="300"/>
        </walker>
        <walker>
            <source x="20" y="130"/>
            <target x="520" y="300"/>
        </walker>
        <walker>
            <source x="20" y="200"/>
            <target x="520" y="300"/>
        </walker>
        <walker>
            <source x="520" y="300"/>
            <target x="20" y="30"/>
        </walker>
        <walker>
            <source x="520" y="20"/>
            <target x="20" y="330"/>
        </walker>
        <walker>
            <source x="520" y="300"/>
            <target x="20" y="130"/>
        </walker>
        <walker>
            <source x="520" y="300"/>
            <target x="20" y="160"/>
        </walker>
    </walkerList>
</Config>